"","mousename","mouseprice","mouseratings","mousereview"
"1","Amazon Basics 3-Button Wired USB Computer Mouse, Single, Black","$7.27","4.6 out of 5 stars","79,658"
"2","TMKB Falcon M1SE Ultralight Honeycomb Gaming Mouse, High-Precision 12800DPI Optical Sensor, 6 Programmable Buttons, Customizable RGB, Drag-Free Paracord, Ergonomic, Wired - Matte White","$19.99","4.5 out of 5 stars","917"
"3","Logitech M185 Wireless Mouse, 2.4GHz with USB Mini Receiver, 12-Month Battery Life, 1000 DPI Optical Tracking, Ambidextrous PC/Mac/Laptop - Swift Gray","$29.99","4.5 out of 5 stars","25,736"
"4","Amazon Basics 2.4 Ghz Wireless Optical Computer Mouse with USB Nano Receiver, Black","$13.38","4.5 out of 5 stars","61,081"
"5","TECKNET Wireless Mouse, 2.4G Ergonomic Optical Mouse, Computer Mouse for Laptop, PC, Computer, Chromebook, Notebook, 6 Buttons, 24 Months Battery Life","$14.99","4.5 out of 5 stars","66,171"
"6","Amazon Basics 3-Button Wired USB Computer Mouse, Single, Black","$10.21","4.7 out of 5 stars","1,521"
"7","Amazon Essentials Disney | Marvel | Star Wars Boys and Toddlers' Short-Sleeve Pique Polo Shirts, Pack of 2","$8.99","4.5 out of 5 stars","917"
"8","Razer DeathAdder Essential Gaming Mouse: 6400 DPI Optical Sensor - 5 Programmable Buttons - Mechanical Switches - Rubber Side Grips - Classic Black","$19.99","4.4 out of 5 stars","3,792"
"9","Logitech M170 Wireless Mouse for PC, Mac, Laptop, 2.4 GHz with USB Mini Receiver, Optical Tracking, 12-Months Battery Life, Ambidextrous - Rose","$10.99","4.7 out of 5 stars","2,583"
"10","TECKNET Wireless Mouse, 2.4G USB Computer Mouse with 6-Level Adjustable 3200 DPI, 30 Months Battery, Ergonomic Grips, 6 Buttons Portable for PC, Chromebook, Mac - Grey","$19.99","4.6 out of 5 stars","79,658"
"11","seenda Wireless Mouse, 2.4G Noiseless Mouse with USB Receiver - Portable Computer Mice for PC, Tablet, Laptop with Windows System - Mint Green","$29.99","4.7 out of 5 stars","119"
"12","FIRSTBLOOD ONLY GAME. AJ52 Watcher RGB Gaming Mouse, Programmable 7 Buttons, Ergonomic LED Backlit USB Gamer Mice Computer Laptop PC, for Windows Mac Linux OS, Star White","$9.99","4.4 out of 5 stars","10,428"
"13","Amazon Basics Ergonomic 2.4 GHz Wireless Optical Mouse, DPI adjustable, Compatible with PC, Mac, Laptop - Black","$11.99","4.5 out of 5 stars","48,585"
"14","Redragon M612 Predator RGB Gaming Mouse, 8000 DPI Wired Optical Gamer Mouse with 11 Programmable Buttons & 5 Backlit Modes, Software Supports DIY Keybinds Rapid Fire Button","$7.27","4.4 out of 5 stars","48,933"
"15","Logitech MX Master 2S Wireless Mouse - Hyper-Fast Scrolling, Ergonomic, Rechargeable, Control 3 Computers, Graphite","$12.40","4.5 out of 5 stars","118,541"
"16","Logitech M510 Wireless Computer Mouse – Comfortable Shape with USB Unifying Receiver, with Back/Forward Buttons and Side-to-Side Scrolling, Dark Gray","$24.24","4.6 out of 5 stars","4,462"
"17","Wired Gaming Mouse [Breathing RGB LED] [Plug Play] High-Precision Adjustable 7200 DPI, 7 Programmable Buttons, Ergonomic Computer USB Mice for Windows/PC/Mac/Laptop Gamer","$29.99","4.4 out of 5 stars","21,213"
"18","Logitech G203 Wired Gaming Mouse, 8,000 DPI, Rainbow Optical Effect LIGHTSYNC RGB, 6 Programmable Buttons, On-Board Memory, Screen Mapping, PC/Mac Computer and Laptop Compatible - Lilac","$9.99","4.6 out of 5 stars","3,398"
"19","Logitech G502 HERO High Performance Wired Gaming Mouse, HERO 25K Sensor, 25,600 DPI, RGB, Adjustable Weights, 11 Programmable Buttons, On-Board Memory, PC / Mac","$9.98","4.6 out of 5 stars","16,230"
"20","Microsoft MAIN-35956 Sculpt Ergonomic Mouse (L6V-00001)","$12.99","4.7 out of 5 stars","38,637"
"21","SM66 White Silent Dual Mode Bluetooth/2.4GHz Wireless Mouse, Adjustable 4200 DPI,Rechargeable Computer Mouse Wireless Office Mouse for PC Mac Laptop, Desktop","$7.27","4.7 out of 5 stars","16"
"22","Cute Wireless Mouse, Silent Dual Mode Bluetooth Mice for Laptop, iPad, Comupter, Tablet with USB Receiver(Kerry Bear)","$19.99","4.5 out of 5 stars","266"
"23","Redragon M908 Impact RGB LED MMO Gaming Mouse with 12 Side Buttons, Optical Wired Ergonomic Gamer Mouse with Max 12,400DPI, High Precision, 20 Programmable Macro Shortcuts, Comfort Grip","$29.99","4.5 out of 5 stars","13,183"
"24","Logitech MX Master 3S - Wireless Performance Mouse, Ergo, 8K DPI, Track on Glass, Quiet Clicks, USB-C, Bluetooth, Windows, Linux, Chrome - Graphite - With Free Adobe Creative Cloud Subscription","$13.38","4.6 out of 5 stars","6,947"
"25","Wired Mouse with Ergonomic Design Reduces Hand Fatigue Muscle Strain, Silent USB Computer Mouse, 1600 DPI Office and Home Mice (Black, Wired)","$14.99","4.6 out of 5 stars","4,823"
"26","Wireless Bluetooth Mouse, Rechargeable LED Dual Mode Mouse (Bluetooth 5.2 and USB Receiver) Portable Silent Mouse,for Laptop/Desktop/Tablet(Black)","$10.21","4.3 out of 5 stars","1,970"
"27","BENGOO Gaming Mouse Wired, Ergonomic Gamer Laptop PC USB Optical Computer Mice with RGB Backlit, 4 Adjustable DPI Up to 3600, 6 Programmable Buttons for Windows 7/8/10/XP Vista Linux -Black","$8.99","4.6 out of 5 stars","12,143"
"28","VssoPlor Wireless Mouse, 2.4G Slim Portable Computer Mice with Nano Receiver for Notebook, PC, Laptop, Computer (Black and Gold)","$19.99","4.6 out of 5 stars","18,731"
"29","Wireless D-09 Computer Mouse USB Cordless Mice for Laptop, Ergo Grips, Lightspeed 5-Level 2400 DPI, 16 Months Battery, Portable for PC Mac Chromebook, 6 Button, Stormy Black","$10.99","4.5 out of 5 stars","9,086"
"30","Nulea M501 Wireless Trackball Mouse, Rechargeable Ergonomic, Easy Thumb Control, Precise & Smooth Tracking, 3 Device Connection (Bluetooth or USB), Compatible for PC, Laptop, iPad, Mac, Windows.","$19.99","4.3 out of 5 stars","7,710"
"31","Lenovo 530 Full Size Wireless Computer Mouse for PC, Laptop, Computer with Windows - 2.4 GHz Nano USB Receiver - Ambidextrous Design - 12 Months Battery Life - Cherry Red","$29.99","4.6 out of 5 stars","5,188"
"32","FIRSTBLOOD ONLY GAME. AJ52 Watcher RGB Gaming Mouse, Programmable 7 Buttons, Ergonomic LED Backlit USB Gamer Mice Computer Laptop PC, for Windows Mac Linux OS, Star White","$9.99","4.6 out of 5 stars","4,462"
"33","E-YOOSO Wireless Mouse, Computer Mouse 18 Months Battery Life Cordless Mouse, 5 Level 4800 DPI, 6 Button Ergo Wireless Mice, 2.4G Portable USB Wireless Mouse for Laptop, Mac, Chromebook, PC, Windows","$11.99","4.4 out of 5 stars","6,674"
"34","【Upgrade】 LED Wireless Mouse, Slim Silent Mouse 2.4G Portable Mobile Optical Office Mouse with USB & Type-c Receiver, 3 Adjustable DPI Levels for Notebook, PC, Laptop, Computer, MacBook (Black)","$7.27","4.5 out of 5 stars","46,975"
"35","TMKB Falcon M1SE Ultralight Honeycomb Gaming Mouse, High-Precision 12800DPI Optical Sensor, 6 Programmable Buttons, Customizable RGB, Drag-Free Paracord, Ergonomic, Wired - Matte White","$12.40","4.4 out of 5 stars","917"
"36","Wireless Bluetooth Mouse,LED Rechargeable Laptop Mouse .Portable Office Computer Mice use(BT5.2 and USB 2.4G) Dual Mode Connection,Silent,Slim,for Apple Laptop/ipad Tablet/Mac/PC/phone.(Black)","$24.24","4.3 out of 5 stars","345"
"37","Bluetooth Mouse,Rechargeable Wireless Mouse for MacBook Pro/MacBook Air,Bluetooth Wireless Mouse for Laptop/PC/Mac/iPad pro/Computer","$29.99","4.4 out of 5 stars","27,078"
"38","Bluetooth Mouse,Rechargeable Wireless Mouse with Tri-Mode (BT 5.0/4.0+2.4GHz), Visible Battery Level, Ergonomic Design Silent Wireless Mouse for Laptop and PC(Yellow)","$9.99","4.4 out of 5 stars","2,011"
"39","INPHIC Mouse, 3 Modes Bluetooth 5.0&4.0 Mouse 2.4G Rechargeable Wireless Mouse with 6 Buttons, Ergonomic Computer Mouse for Laptop, Mac, PC etc.","$9.98","4.6 out of 5 stars","24,175"
"40","Trueque Wireless Mouse for Laptop, 2.4GHz Ergonomic Computer Mouse with Back & Forward Buttons, 3-Level DPI, 6 Buttons, Optical USB Cordless Mice for Windows Chromebook MacBook PC","$12.99",NA,"4,126"
"41","SM66 White Silent Dual Mode Bluetooth/2.4GHz Wireless Mouse, Adjustable 4200 DPI,Rechargeable Computer Mouse Wireless Office Mouse for PC Mac Laptop, Desktop","$7.27","4.7 out of 5 stars","16"
"42","Cute Wireless Mouse, Silent Dual Mode Bluetooth Mice for Laptop, iPad, Comupter, Tablet with USB Receiver(Kerry Bear)","$19.99","4.5 out of 5 stars","266"
"43","Redragon M801 Gaming Mouse LED RGB Backlit MMO 9 Programmable Buttons Mouse with Macro Recording Side Buttons Rapid Fire Button 16000 DPI for Windows PC Gamer (Wireless, Black)","$29.99","4.6 out of 5 stars","5,761"
"44","T-DAGGER Wireless Gaming Mouse- USB Cordless PC Accessories Computer Mice with LED Backlit, Ergonomic Gamer Laptop Mouse with 7 Silent Buttons, 5 Adjustable DPI Plug & Play for PC","$13.38","4.5 out of 5 stars","1,720"
"45","TECKNET Wireless Mouse, Bluetooth Mouse for Laptop 2-in-1(Bluetooth 5.0/3.0+2.4Ghz) Computer Mouse, Portable Ergonomic PC Mouse Wireless with USB Receiver, Compatible with MacBook Pro Air Chromebook","$14.99","4.5 out of 5 stars","6,846"
"46","Razer Basilisk Ultimate HyperSpeed Wireless Gaming Mouse: Fastest Gaming Mouse Switch - 20K DPI Optical Sensor - Chroma RGB Lighting - 11 Programmable Buttons - 100 Hr Battery - Classic Black","$10.21","4.5 out of 5 stars","9,371"
"47","Logitech MX Anywhere 2 Wireless Mouse – Use On Any Surface, Hyper-Fast Scrolling, Rechargeable, for Apple Mac or Microsoft Windows Computers and laptops, Meteorite","$8.99","4.6 out of 5 stars","2,248"
"48","Microsoft Wireless Bluetooth Mouse (2022), Sculpted Design for Ultimate Comfort and Smooth Scrolling, up to 1 Year of Battery Life, 2.4G Range, Forest Color","$19.99","4.7 out of 5 stars","9,069"
"49","Logitech M720 Triathlon Multi-Device Wireless Mouse, Bluetooth, USB Unifying Receiver, 1000 DPI, 8 Buttons, 2-Year Battery, Compatible with Laptop, PC, Mac, iPadOS - Black","$10.99","4.5 out of 5 stars","20,297"
"50","Logitech G305 LIGHTSPEED Wireless Gaming Mouse, Hero 12K Sensor, 12,000 DPI, Lightweight, 6 Programmable Buttons, 250h Battery Life, On-Board Memory, PC/Mac - White","$19.99","4.6 out of 5 stars","28,604"
"51","Lenovo 530 Full Size Wireless Computer Mouse for PC, Laptop, Computer with Windows - 2.4 GHz Nano USB Receiver - Ambidextrous Design - 12 Months Battery Life - Cherry Red","$29.99","4.6 out of 5 stars","5,188"
"52","New 2.4G Wireless Rechargeable Gaming Mouse Silent Click with 6 Buttons, 3 Adjustable Levels DPI, Colorful LED Lights for Laptop, iPad, MacOS, PC, Windows, Android (Black)","$9.99","4.3 out of 5 stars","156"
"53","TECKNET Bluetooth Mouse, 3200 DPI Computer Mouse, 2-Year Battery Wireless Mouse 6 Adjustable DPI, 6 Buttons Compatible with Laptop/Windows/Computer","$11.99","4.3 out of 5 stars","17,272"
"54","seenda Ergonomic Mouse, Wireless Vertical Mouse - Rechargeable Optical Mice for Multi-Purpose (Bluetooth 5.0 + Bluetooth 3.0 + USB Connection) Compatible Apple Mac and Windows Computers - Black","$7.27","4.5 out of 5 stars","2,428"
"55","Razer Basilisk X Hyperspeed - Wireless Gaming Mouse (Hyperspeed Technology, Advanced 5G Optical Sensor and 6 Configurable Buttons, Mechanical Mouse Switches, Ultra-Long Battery Life) Black","$12.40","4.3 out of 5 stars","17,187"
"56","Lekvey Ergonomic Mouse, Vertical Wireless Mouse - Rechargeable 2.4GHz Optical Vertical Mice : 3 Adjustable DPI 800/1200/1600 Levels 6 Buttons, for Laptop, PC, Computer, Desktop, Notebook etc, Black","$24.24","4.7 out of 5 stars","13,213"
"57","Logitech M510 Mouse, Wireless Black, 910-001825 (Black)","$29.99","4.5 out of 5 stars","3,917"
"58","Redragon Gaming Mouse, Wireless Mouse Gaming with 8000 DPI, PC Gaming Mice with Fire Button, RGB Backlit Programmable Ergonomic Mouse Gamer, Rechargeable, 70Hrs for Windows, Mac Gamer, Black","$9.99","4.7 out of 5 stars","1,708"
"59","Razer DeathAdder V2 X HyperSpeed: Award-Winning Ergonomic Design - Ultra-Fast Wireless - 235hr Battery Life - 7 Programmable Buttons - Gen 2 Mechanical Switches - 5G 14K DPI Optical Sensor","$9.98","4.6 out of 5 stars","17,985"
"60","Razer Viper Ultimate Lightweight Wireless Gaming Mouse & RGB Charging Dock: Hyperspeed Wireless Technology - 20K DPI Optical Sensor - 74g Lightweight - 70 Hr Battery - Mercury White","$12.99","4.3 out of 5 stars","15,898"
"61","SM66 White Silent Dual Mode Bluetooth/2.4GHz Wireless Mouse, Adjustable 4200 DPI,Rechargeable Computer Mouse Wireless Office Mouse for PC Mac Laptop, Desktop","$7.27","4.7 out of 5 stars","16"
"62","Cute Wireless Mouse, Silent Dual Mode Bluetooth Mice for Laptop, iPad, Comupter, Tablet with USB Receiver(Kerry Bear)","$19.99","4.5 out of 5 stars","266"
"63","Logitech MX Master 3S - Wireless Performance Mouse, Ergo, 8K DPI, Track on Glass, Quiet Clicks, USB-C, Bluetooth, Windows, Linux, Chrome - Graphite - With Free Adobe Creative Cloud Subscription","$29.99","4.6 out of 5 stars","6,947"
"64","Logitech Lift Vertical Ergonomic Mouse, Wireless, Bluetooth or Logi Bolt USB receiver, Quiet clicks, 4 buttons, compatible with Windows/macOS/iPadOS, Laptop, PC - Off White","$13.38","4.6 out of 5 stars","7,336"
"65","TECKNET Bluetooth Mouse, 3200 DPI Computer Mouse, 2-Year Battery Wireless Mouse 6 Adjustable DPI, 6 Buttons Compatible with Laptop/Windows/Computer","$14.99","4.3 out of 5 stars","17,272"
"66","INPHIC Wireless Mouse, 2.4G Silent Rechargeable Ultra Slim USB Portable Mouse, 1600 DPI & 700mAh Battery with Visible Level for Laptop PC Computer & MacBook (LED-Black)","$10.21","4.4 out of 5 stars","49,778"
"67","Razer Basilisk X Hyperspeed - Wireless Gaming Mouse (Hyperspeed Technology, Advanced 5G Optical Sensor and 6 Configurable Buttons, Mechanical Mouse Switches, Ultra-Long Battery Life) Black","$8.99","4.5 out of 5 stars","17,187"
"68","Razer DeathAdder V2 X HyperSpeed: Award-Winning Ergonomic Design - Ultra-Fast Wireless - 235hr Battery Life - 7 Programmable Buttons - Gen 2 Mechanical Switches - 5G 14K DPI Optical Sensor","$19.99","4.7 out of 5 stars","17,985"
"69","Lekvey Ergonomic Mouse, Vertical Wireless Mouse - Rechargeable 2.4GHz Optical Vertical Mice : 3 Adjustable DPI 800/1200/1600 Levels 6 Buttons, for Laptop, PC, Computer, Desktop, Notebook etc, Black","$10.99","4.3 out of 5 stars","13,213"
"70","E-YOOSO Wireless Mouse, USB Cordless Computer Mouse, 18 Months Battery Life, 6 Button Wireless Mouse, 5 Adjustable DPI, 2.4G Portable Wireless Optical Mice for Windows, Mac, Linux, Chromebook(Black)","$19.99","4.5 out of 5 stars","1,641"
"71","Lenovo 530 Full Size Wireless Computer Mouse for PC, Laptop, Computer with Windows - 2.4 GHz Nano USB Receiver - Ambidextrous Design - 12 Months Battery Life - Cherry Red","$29.99","4.6 out of 5 stars","5,188"
"72","Topographic Contour Gaming Mouse Pad for Desk, Office Large Desk Mat, Long Computer Keyboard Mouse Mat Mousepad with Non-Slip Base and Stitched Edge, Valentine's Day Gifts for Him","$9.99","4.6 out of 5 stars","6,842"
"73","Logitech M317 Wireless Mouse, 2.4 GHz with USB Receiver, 1000 DPI Optical Tracking, 12 Month Battery, Compatible with PC, Mac, Laptop, Chromebook - Blue","$11.99","4.5 out of 5 stars","6,817"
"74","LODVIE Wireless Mouse for Laptop, 2400 DPI Wireless Computer Mouse with 6 Buttons,2.4G Ergonomic USB Cordless Mouse,18 Months Battery Life Mouse for Laptop PC Mac Computer Chromebook MacBook - Black","$7.27","4.3 out of 5 stars","2,428"
"75","seenda Ergonomic Mouse, Wireless Vertical Mouse - Rechargeable Optical Mice for Multi-Purpose (Bluetooth 5.0 + Bluetooth 3.0 + USB Connection) Compatible Apple Mac and Windows Computers - Black","$12.40","4.3 out of 5 stars","3,654"
"76","Razer Naga Pro Wireless Gaming Mouse: Interchangeable Side Plate w/ 2, 6, 12 Button Configurations - Focus+ 20K DPI Optical Sensor - Fastest Gaming Mouse Switch - Chroma RGB Lighting","$24.24","4.7 out of 5 stars","2,583"
"77","HP X500 - Wired USB Mouse for Windows PC Desktop, Laptop, Notebook, Mac, computerand Chromebook, for Righty or Lefty Use (E5E76AA#ABA),Black","$29.99","4.7 out of 5 stars","65"
"78","seenda Wireless Mouse, Type C Mouse with Jiggler - Light Up USB C Mouse, USB&Type C Receiver, Build-in Jiggler Mover Compatible with MacBook,iPad,Windows Tablet/Laptop/Computer, Green","$9.99","4.6 out of 5 stars","15,898"
"79","Razer Viper Ultimate Lightweight Wireless Gaming Mouse & RGB Charging Dock: Hyperspeed Wireless Technology - 20K DPI Optical Sensor - 74g Lightweight - 70 Hr Battery - Mercury White","$9.98","4.4 out of 5 stars","9,060"
"80","HOTLIFE LED Wireless Mouse, Slim Rechargeable Silent Portable USB Optical 2.4G Wireless Bluetooth Two Mode Computer Mice with USB Receiver and Type C Adapter (Black)","$12.99","4.3 out of 5 stars","3,298"
"81","Macally USB Wired Mouse for Mac or PC - Comfortable, Smooth, and Quiet - White USB Mouse Wired with 5ft Cable and 4 DPI - Plug and Play Corded Computer Mouse for Laptop or Office Desktop - White","$7.27","4.5 out of 5 stars","344"
"82","TECKNET Wireless Mouse, 2.4G Ergonomic Optical Mouse, Computer Mouse for Laptop, PC, Computer, Chromebook, Notebook, 6 Buttons, 24 Months Battery Life","$19.99","4.5 out of 5 stars","66,171"
"83","SM600 White Wireless Gaming Mouse Bluetooth Mouse with Honeycomb Shell, Side Buttons,Tri-Modes(BT5.1+BT5.1+2.4GHz) RGB Wireless Mouse for PC/Tablet/Desktop/Office/Games","$29.99","4.3 out of 5 stars","827"
"84","RaceGT Type C Wireless Computer Mouse, 2.4G Silent Cordless Mouse for Laptop, USB C Mouse with 6 Buttons and 3 Adjustable DPI for Laptop, Deskbtop, MacBook, PC","$13.38","4.3 out of 5 stars","3,298"
"85","INPHIC Wireless Mouse 700mAh Large Ergonomic Rechargeable 2.4G Optical PC Laptop Cordless Mice with USB Nano Receiver, for Windows Computer Office, Black","$14.99","4.5 out of 5 stars","27,763"
"86","DIERYA M1SE Wired Gaming Mouse with Honeycomb Shell, 12800DPI Optical Sensor, 6 Programmable Macros, Software Support for Custom Key Config, and RGB Settings for Windows 7/8/10/XP, Vista, Linux-White","$10.21","4.4 out of 5 stars","766"
"87","Bluetooth Wireless Mouse - (BT1/BT2+USB) Tri-Mode High Performance, Rechargeable, Quiet Click, Multi-Device Compatibility for Laptop, Computer, MacBook, Tablet, PC (Black)","$8.99","4.3 out of 5 stars","705"
"88","VersionTECH. Wireless Gaming Mouse, Rechargeable Computer Mouse Mice with Colorful LED Lights, Silent Click, 2.4G USB Nano Receiver, 3 Level DPI for PC Gamer Laptop Desktop Chromebook Mac-Black","$19.99","4.6 out of 5 stars","4,862"
"89","Logitech Signature M650 L Left Wireless Mouse - For Large Sized Left Hands, 2-Year Battery, Silent Clicks, Customizable Side Buttons, Bluetooth, for PC/Mac/Multi-Device/Chromebook - Graphite","$10.99","4.5 out of 5 stars","9,342"
"90","ROCCAT Kone XP Air – Wireless Customizable Ergonomic RGB Gaming Mouse, 19K DPI Optical Sensor, 100-hour Battery & Charging Dock, 29 Programmable Inputs & AIMO RGB Lighting, 4D Wheel – White","$19.99","4.4 out of 5 stars","791"
"91","memzuoix 2.4G Wireless Mouse, 1200 DPI Mobile Optical Cordless Mouse with USB Receiver, Portable Computer Mice for Laptop, PC, Desktop, MacBook, 5 Buttons, Red","$29.99","4.5 out of 5 stars","15,378"
"92","OKIMO Wireless Mouse for Laptop Computer Mouse with USB Receiver 2.4GHz Optical Tracking Computer Mouse Ergonomic Portable Mouse for PC Laptop (Mint)","$9.99","4.5 out of 5 stars","3,792"
"93","Ergonomic Mouse Wireless,Rechargeable Vertical Mouse Right Handed Small Mouse with 6 Buttons 3 Adjustable 1000/1200/1600 DPI for Laptop,Desktop,PC, MacBook（Purple","$11.99","4.4 out of 5 stars","2,235"
"94","DeLUX Seeker Wireless Ergonomic Vertical Mouse with OLED Screen, BT and USB Receiver, Connect with Up to 4 Devices, Thumb Wheel, 4000DPI, Programmable Rechargeable Silent Mouse(M618XSD-Black)","$7.27","4.4 out of 5 stars","770"
"95","Redragon M711 Cobra RGB Optical Gaming Mouse Black","$12.40","4.6 out of 5 stars","5,883"
"96","Razer Cobra Gaming Mouse: 58g, Gen-3 Optical Switches, Chroma RGB Lighting, 8500 DPI Sensor, PTFE Feet, Speedflex Cable - Black","$24.24","4.5 out of 5 stars","342"
"97","Nulea Wireless Ergonomic Trackball Mouse, Rechargeable, Bluetooth, 44mm Index Finger Trackball, 5 Adjustable DPI, Compatible with PC, Laptop, iPad, Mac, Windows, Android","$29.99",NA,"982"
"98","UHURU Wireless Gaming Mouse Up to 10000 DPI, Rechargeable USB Wireless Mouse with 6 Buttons 7 Dynamic LED Color Ergonomic Programmable MMO RPG for PC Laptop, Compatible with Windows Mac","$9.99",NA,"10,632"
"99","Dell Bluetooth Travel Mouse, Black, 56.9g","$9.98",NA,"62"
"100","Logitech MX Master 3S - Wireless Performance Mouse with Ultra-Fast Scrolling, Ergo, 8K DPI, Track on Glass, Quiet Clicks, USB-C, Bluetooth, Windows, Linux, Chrome (Black)","$12.99",NA,"174"
